{
  "timestampMs": 520,
  "gestureModel": "ready",
  "hands": [],
  "upperBody": [],
  "gesture": null,
  "trackingQuality": {
    "state": "no-person",
    "personDetected": false,
    "upperBodyVisible": false,
    "leftHandVisible": false,
    "rightHandVisible": false,
    "handsInsideFrame": false
  },
  "calibration": {
    "state": "collecting",
    "stableFrames": 0,
    "requiredStableFrames": 8
  },
  "gesturePhase": "idle"
}
